{
  "schemaVersion": 1,
  "programCount": 16,
  "validProgramCount": 16,
  "programs": [
    {
      "programId": "CARDI:0003",
      "evidenceId": "O:vendetta-faq-2026-08-14:0003",
      "expectedCoreSourceId": "core-rules-2026-07-16",
      "expectedOfficialAnswerSha256": "b123334e8119340d56a680ab113b92240e9d0eb88f6fe2e957732dc3a462fa5c",
      "expectedIdentityTextHashes": {
        "azir sovereign": [
          "8257f10343cb58c947c905703250505895e5c6da205a8f98e689ad86f6501281"
        ],
        "iascylla": [
          "40dff0103e7e3534cd1d9c408a63db8038c56802ba4e87667e958befa8075f37"
        ]
      },
      "requiredRuleIds": [
        "359.3.f"
      ],
      "requiredClauseEffectTags": {
        "iascylla": [
          "trigger"
        ],
        "azir sovereign": [
          "trigger"
        ]
      },
      "minimumParaphraseScore": 0.9,
      "outcomes": [
        {
          "issueIndex": 0,
          "verdict": "iascylla_snapshots_held_battlefield_azir_checks_current_battlefield",
          "claim": "Iascylla preserves the battlefield identified by her trigger condition, while Azir, Sovereign checks the battlefield where he is located when his attack trigger resolves."
        }
      ],
      "valid": true,
      "executable": true,
      "validationErrors": [],
      "compilerVersion": 1
    },
    {
      "programId": "CARDI:0004",
      "evidenceId": "O:vendetta-faq-2026-08-14:0004",
      "expectedCoreSourceId": "core-rules-2026-07-16",
      "expectedOfficialAnswerSha256": "d0e13cbfdc99f9a2dc4c1ee1e7ef16a533eb074f6a435b545623e2812ae7cbf5",
      "expectedIdentityTextHashes": {
        "mel newly awakened": [
          "96509db44782bef3cd1436649b713241e1085a66f12507882fa8f21e02a46130",
          "e4dfa40a51c9b488ca53b1f66f46bceecd54ab2a5690976ff27ba24a7b2617f2"
        ],
        "moonfall": [
          "19ed67315386fb6d31f174642d9855b2f3743222400808364bb668cfb305f1b6"
        ]
      },
      "requiredRuleIds": [
        "370.1",
        "370.1.b"
      ],
      "requiredClauseEffectTags": {
        "mel newly awakened": [
          "might",
          "choose"
        ],
        "moonfall": [
          "might",
          "choose"
        ]
      },
      "minimumParaphraseScore": 0.9,
      "outcomes": [
        {
          "issueIndex": 0,
          "verdict": "moonfall_chosen_unit_minus3_others_minus2",
          "claim": "Empowered Mel replaces only Moonfall’s chosen unit -2 Might event with -3 Might; the other enemy units at that battlefield still receive -2 Might."
        }
      ],
      "valid": true,
      "executable": true,
      "validationErrors": [],
      "compilerVersion": 1
    },
    {
      "programId": "CARDI:0005",
      "evidenceId": "O:vendetta-faq-2026-08-14:0005",
      "expectedCoreSourceId": "core-rules-2026-07-16",
      "expectedOfficialAnswerSha256": "989e66d7512156cb17e55e9a58a61dc676131be8f6baa5d03ab6e3901a1c5650",
      "expectedIdentityTextHashes": {
        "mel newly awakened": [
          "96509db44782bef3cd1436649b713241e1085a66f12507882fa8f21e02a46130",
          "e4dfa40a51c9b488ca53b1f66f46bceecd54ab2a5690976ff27ba24a7b2617f2"
        ],
        "stupefy": [
          "19e28ec034f7ca6d3126938758679f6163766fef34686b92440b88139f4091b2"
        ]
      },
      "requiredRuleIds": [
        "375"
      ],
      "requiredClauseEffectTags": {
        "mel newly awakened": [
          "might",
          "choose"
        ],
        "stupefy": [
          "might"
        ]
      },
      "minimumParaphraseScore": 0.9,
      "outcomes": [
        {
          "issueIndex": 0,
          "verdict": "stupefy_minus2_minimum1",
          "claim": "Empowered Mel replaces Stupefy’s -1 Might with -2 Might, and the replacement inherits Stupefy’s minimum-of-1 modification."
        }
      ],
      "valid": true,
      "executable": true,
      "validationErrors": [],
      "compilerVersion": 1
    },
    {
      "programId": "CARDI:0006",
      "evidenceId": "O:vendetta-faq-2026-08-14:0006",
      "expectedCoreSourceId": "core-rules-2026-07-16",
      "expectedOfficialAnswerSha256": "049c552b10ebbe09b25519b8cd5d8100854df8b8264479256dff9aa44ead5eb6",
      "expectedIdentityTextHashes": {
        "abandon": [
          "4bb5146b69df886c9df1345b817f7e25fc6ae81588b36393f2f1db155bd33cad"
        ],
        "mel newly awakened": [
          "96509db44782bef3cd1436649b713241e1085a66f12507882fa8f21e02a46130",
          "e4dfa40a51c9b488ca53b1f66f46bceecd54ab2a5690976ff27ba24a7b2617f2"
        ]
      },
      "requiredRuleIds": [],
      "requiredClauseEffectTags": {
        "mel newly awakened": [
          "counter"
        ],
        "abandon": [
          "counter",
          "replace"
        ]
      },
      "minimumParaphraseScore": 0.9,
      "outcomes": [
        {
          "issueIndex": 0,
          "verdict": "yes_abandon_can_be_played",
          "claim": "Abandon can be played targeting the spell even though empowered Mel prevents that spell from being countered."
        },
        {
          "issueIndex": 1,
          "verdict": "abandon_predict_only_no_counter_or_return",
          "claim": "Abandon fails to counter the spell, so no countered-card Trash event exists for its return-to-hand replacement; it still Predicts and otherwise has no effect on that spell."
        }
      ],
      "valid": true,
      "executable": true,
      "validationErrors": [],
      "compilerVersion": 1
    },
    {
      "programId": "CARDI:0007",
      "evidenceId": "O:vendetta-faq-2026-08-14:0007",
      "expectedCoreSourceId": "core-rules-2026-07-16",
      "expectedOfficialAnswerSha256": "b1be194a6853546a90ea922d987a7679909b4ef0552660b9c2cc3cd19a5e1897",
      "expectedIdentityTextHashes": {
        "abandon": [
          "4bb5146b69df886c9df1345b817f7e25fc6ae81588b36393f2f1db155bd33cad"
        ],
        "mel newly awakened": [
          "96509db44782bef3cd1436649b713241e1085a66f12507882fa8f21e02a46130",
          "e4dfa40a51c9b488ca53b1f66f46bceecd54ab2a5690976ff27ba24a7b2617f2"
        ],
        "rebuttal": [
          "e530648eb62730b1d77b90ddc3b21226217f7341519406c37baed2039b776f4b"
        ]
      },
      "requiredRuleIds": [],
      "requiredClauseEffectTags": {
        "mel newly awakened": [
          "counter"
        ],
        "abandon": [
          "counter"
        ],
        "rebuttal": [
          "control"
        ]
      },
      "minimumParaphraseScore": 0.9,
      "outcomes": [
        {
          "issueIndex": 0,
          "verdict": "rebuttal_control_change_is_not_countering",
          "claim": "Rebuttal gaining control of a spell is not countering that spell, so empowered Mel’s protection from countering does not prevent the control change."
        }
      ],
      "valid": true,
      "executable": true,
      "validationErrors": [],
      "compilerVersion": 1
    },
    {
      "programId": "CARDI:0009",
      "evidenceId": "O:vendetta-faq-2026-08-14:0009",
      "expectedCoreSourceId": "core-rules-2026-07-16",
      "expectedOfficialAnswerSha256": "7e8d08923378d1bdc40a67c358a1effe782351252c9a95297c6a9f77fbcfaeac",
      "expectedIdentityTextHashes": {
        "shady spectacles": [
          "cdc7ab64cea0544150a069e5e6dd3b1bed6ad28d2c08eb7abb5b74523753d1b5"
        ]
      },
      "requiredRuleIds": [
        "477.1.b"
      ],
      "requiredClauseEffectTags": {
        "shady spectacles": [
          "copy"
        ]
      },
      "minimumParaphraseScore": 0.9,
      "outcomes": [
        {
          "issueIndex": 0,
          "verdict": "empowered_status_not_copied",
          "claim": "Shady Spectacles copies copyable traits, not temporary status; the equipped unit remains unempowered when it copies an empowered unit."
        }
      ],
      "valid": true,
      "executable": true,
      "validationErrors": [],
      "compilerVersion": 1
    },
    {
      "programId": "CARDI:0010",
      "evidenceId": "O:vendetta-faq-2026-08-14:0010",
      "expectedCoreSourceId": "core-rules-2026-07-16",
      "expectedOfficialAnswerSha256": "caba8240ba96a6bae6611c30019692cf909386267d34993fb1802c1be2784aff",
      "expectedIdentityTextHashes": {
        "akshan mischievous": [
          "3a8419d4877abe545dca1aa46a4c8a60b5e9ddabdc490adee40892ffc74dffbf"
        ],
        "shady spectacles": [
          "cdc7ab64cea0544150a069e5e6dd3b1bed6ad28d2c08eb7abb5b74523753d1b5"
        ]
      },
      "requiredRuleIds": [
        "369.1",
        "370.1.a",
        "370.1.b"
      ],
      "requiredClauseEffectTags": {
        "akshan mischievous": [
          "attach",
          "control"
        ],
        "shady spectacles": [
          "attach",
          "copy"
        ]
      },
      "minimumParaphraseScore": 0.9,
      "outcomes": [
        {
          "issueIndex": 0,
          "verdict": "stolen_spectacles_old_copy_ends_then_akshan_copies",
          "claim": "When Akshan takes the equipped Shady Spectacles, the old equipped unit loses its copy effect; the Equipment attaches to Akshan and then Akshan becomes a copy chosen by his controller."
        },
        {
          "issueIndex": 1,
          "verdict": "copied_aphelios_trigger_does_not_see_prior_attach",
          "claim": "If Akshan becomes a copy of Aphelios, the newly copied triggered ability does not trigger from the already-completed Attach event."
        }
      ],
      "valid": true,
      "executable": true,
      "validationErrors": [],
      "compilerVersion": 1
    },
    {
      "programId": "CARDI:0014",
      "evidenceId": "O:vendetta-faq-2026-08-14:0014",
      "expectedCoreSourceId": "core-rules-2026-07-16",
      "expectedOfficialAnswerSha256": "dc6704c6c7eb5e112820f9f1ab7c4267a4b0038dd553407efad02dac98b42f2e",
      "expectedIdentityTextHashes": {
        "crumbling sands": [
          "8992d08c5b89d262e4b5ab0c1513f61786c54bb500d12eb7f4e56de343a7b2c7"
        ]
      },
      "requiredRuleIds": [
        "419.4.b"
      ],
      "requiredClauseEffectTags": {